{
  "schema_version": "1.0.0",
  "generator": {
    "name": "controlloop",
    "version": "0.1.0"
  },
  "repository": {
    "commit": "abc123",
    "root_digest": "sha256:dddddddddddddddddddddddddddddddddddddddddddddddddddddddddddddddd"
  },
  "acbom_schema_version": "1.0.0",
  "acbom_digest": "sha256:eeeeeeeeeeeeeeeeeeeeeeeeeeeeeeeeeeeeeeeeeeeeeeeeeeeeeeeeeeeeeeee",
  "effective_authority": [
    {
      "schema_version": "1.0.0",
      "agent_id": "clp:agent:sha256:aaaaaaaaaaaaaaaaaaaaaaaaaaaaaaaaaaaaaaaaaaaaaaaaaaaaaaaaaaaaaaaa",
      "action": "invokes",
      "resource_id": "clp:tool:sha256:bbbbbbbbbbbbbbbbbbbbbbbbbbbbbbbbbbbbbbbbbbbbbbbbbbbbbbbbbbbbbbbb",
      "permitting_identity_id": "clp:identity:sha256:cccccccccccccccccccccccccccccccccccccccccccccccccccccccccccccccc",
      "confidence": "high",
      "evidence": [
        {
          "adapter": "mcp",
          "path": "mcp/tools-list.json"
        }
      ]
    }
  ],
  "digest": "sha256:46fa34c90860d9b70d33ba83d5a7669a263c347e3c56699c266d4fbb84a5bf3d"
}
